web-scraper-order,web-scraper-start-url,noticia,noticia-href,texto
"1680116302-1","https://as.com/futbol/mundial/","Atropellados por Messi","https://as.com/futbol/mundial/atropellados-por-messi-n/","Este contenido tiene un vídeo que no está disponible en tu zona geográfica
           
        

    
    







El Mundial de Qatar fue el de Messi. Por unanimidad, la figura del argentino queda para siempre grabada en la historia del fútbol. El reconocimiento global de su trayectoria, coronada brillantemente ante Francia en la final, le sitúa como el mejor de siempre por títulos. No hay gran torneo de clubes o de selección que se le haya resistido. Pese a que tuvo varios años difíciles que coincidieron con los batacazos del Barça en Champions y su llegada al PSG, en el último año ha sido capaz de enderezar el rumbo con un triplete al alcance de muy pocos en Argentina: Copa América, Finalissima y Mundial.La final ante Francia, en realidad todo el torneo, denotaron que era el jugador más concienciado en poder llevarse el título. Al igual que en las rondas anteriores de eliminatorias, fue el faro de una Argentina que se encomendó a él para salir con vida del embite ante otro coloso, Kylian Mbappé. Al mismo tiempo que se coronaba campeón, dejó varios registros que van a ser difíciles de superar para nadie.10L. MessiPSGdelanteroArgentinaNoticiasEstadísticasDurante el Mundial, se convirtió en el jugador con más apariciones en la historia del torneo con 26 superando a toda una leyenda como el alemán Lottar Matthaus. Además, con su doblete en la final igualó a Just Fontaine con 13 goles en los Mundiales sólo por detrás de Miroslav Klose (16), Ronaldo (15) y Gerd Müller (14).Su cifra goleadora en esta edición, siete, supuso la mayor cantidad de un jugador argentino en un Mundial desde Guillermo Stábile (8) en el torneo inaugural, el que se jugó en Uruguay en 1930. Es más, sus goles ante los franceses le colocaron como segundo goleador de mayor edad en una final con 35 años y 177 días -sólo por detrás del sueco Nils Liedholm (35 años y 264). días) en 1958- y el primero en lograr un doblete. Su compatriota Ángel di María, que también marcó, se situó como tercero más veterano con 34 años y 307 días.Otro dato apabullante es que Messi apareció siempre, de principio a fin, en el torneo. De hecho, se erigió en el primer jugador en marcar en la fase de grupos, los octavos, los cuartos, las semifinales y la final en una sola misma edición del Mundial. Ganó el premio al mejor jugador del partido en cinco de los siete disputados.CarácterMessi fue más que datos. Messi fue personalidad. En una época en la que el fútbol físico se va imponiendo, él fue fiel a sí mismo y dotó a Argentina del estilo que más le convenía. Ralentizó cuando hizo falta, aceleró cuando era conveniente. En los momentos difíciles apareció. La responsabilidad de los penaltis, de los goles decisivos, no le pesó. Fue el líder de Argentina desde sus discursos hasta su lenguaje corporal. Transmitió seguridad y carácter ganador, especialmente cuando llegaron los peores instantes.A Messi esta alegría le llega en el momento idóneo. Antes de la final dijo que sería su último partido mundialista y cerró el ciclo de la mejor manera, con el título. No había otra bala en la recámara después de cuatro decepciones anteriores. Messi no se va de la selección, pero 2026 está muy lejos como para seguir en este nivel. No así 2024, fecha prevista para la Copa América.ArgentinaArgentinaNoticiasEstadísticasCon el título y el MVP del Mundial se acerca también a la posibilidad de conquistar su octavo Balón de Oro. Sólo Mbappé parecía en disposición de arrebatárselo, pero al militar en el mismo equipo van a calcar sus títulos a partir de ahora en el PSG con la sutil diferencia de que Messi es campeón del mundo y Mbappé no alcanzó el título. No parece que ningún otro esté en disposición de hacerles sombra, sobre todo porque han quedado lejos de ellos en lo relativo al Mundial.Messi se preparó para Qatar mejor que nadie, cuidó sus esforzó, midió sus desgastes. Pudo organizar su temporada en función del Mundial. No se empleó con más intensidad de la necesaria ni con menos de la requerida. Volvió a sentir buenas vibraciones en París, algo que parecía ya olvidado. Decidió partidos de liga francesa, de Champions. Maravilló en los amistosos de pretemporada. Consiguió unos números con la selección (17 goles en 11 partidos) que recuerdan a los del anterior Messi. O a este que es otro jugador pero mantiene su idilio con el gol. Una mezcla perfecta. Una combinación con la que ganar un Mundial maravillando a todos.QATAR 2022 | ARGENTINA 3 - FRANCIA 3Lo tiene clarísimo: el primer mensaje de Roncero a Messi tras proclamarse campeón del mundoQATAR SIN REDLionel Andrés Messi es trending topic eternoEtiquetado en:FútbolMundial fútbolMundial 2022Selección argentina fútbolSelección francesa fútbolLionel Messi"
"1680116305-2","https://as.com/futbol/mundial/","El mejor once del Mundial según la Inteligencia Artificial","https://as.com/futbol/mundial/mbappe-reina-en-el-once-del-mundial-segun-la-ia-n/","Este contenido tiene un vídeo que no está disponible en tu zona geográfica
           
        

    
    







Argentina se proclamó a noche campeona del Mundo, alzando su tercer cetro en el estadio de Lusail y catapultando a Lionel Messi a la historia del fútbol. Sin embargo, la Inteligencia Artificial mide la calidad y la cantidad de las acciones realizadas por cada jugador. Es decir, una acción se valorará positivamente cuando aumenta la probabilidad de que su equipo marque gol o se reduce la probabilidad de concederlo. Y negativamente cuando penalicen al equipo disminuyendo la probabilidad de marcar gol y aumentando la probabilidad de que te marquen. Además, la IA no tiene en cuenta las tandas de penalti para valorar, en este caso, a los porteros.AmpliarEl XI del Mundial de Qatar según la Inteligencia Artificial.Un XI en el que reina Mbappé. La estrella del PSG se alza con el MVP con una valoración de 5,58, la más alta. Su final fue estratosférica, al igual que su Mundial que se resume en 8 dianas y 2 pases de gol. Además de marcharse de Qatar con la Bota de Oro, sus dos goles le sirvieron para darle dos victorias al conjunto galo ante Dinamarca, en la segunda jornada d la fase de grupos y ante Polonia, para avanzar a octavos de final.Tchouaméni y Theo completan el cupo de franceses presentes en el XI. Ambos son debutantes en una cita mundialista. Tchouaméni ha sido el sostén del equipo de Deschamps desde el primer minuto y se va de Qatar con un gol, el que abrió el marcador en cuartos de final frente a Inglaterra. Theo entró en el equipo a raíz de la lesión de su hermano durante el partido inaugural ante Australia, su final no fue su mejor partido, pero su camino a lo largo de Qatar le sirve para ser el mejor lateral izquierdo del torneo.

La campeona, Argentina, mete a Messi y a Julián Álvarez. El ‘10′ registra la segunda mejor valoración del XI con un 4,9. Sus 7 goles y 3 asistencias sirvieron para obtener la victoria ante México y dar un respiro a la albiceleste de cara a superar la fase de grupos, al igual que contra Holanda y Croacia, en cuartos y semifinales respectivamente. Julián Álvarez no partía como titular para Scaloni, pero su buen hacer en los dos primeros encuentros le sirvieron para ganarse un puesto y desde entonces fue clave para la delantera argentina. Se marcha de Qatar con 4 goles, dos de ellos ante Croacia valieron un pase a la final.Croacia, tercera clasificada, mete hasta tres futbolistas en el XI. Gvardiol y Lovren se alzan como la mejor pareja de centrales del torneo. En particular Josko, que a sus 20 años, ha deslumbrado al mundo con un gran rendimiento. De hecho sus acciones le colocan como el mejor zaguero de Qatar y el quinto futbolista con mayor valoración, además de marcar un golazo de cabeza en el partido por el 3º y 4º puesto. El tercer croata es Kovacic, que junto a Modric y Brozovic formaron uno de los mejores tridentes de mediocentros , siendo fundamentales en el juego de la selección ajedrezada.La zaga la completa Achraf Hakimi, su rendimiento en el lateral derecho ayudó a Marruecos a hacer historia, se convirtieron en la primera selección africana en superar unos cuartos de final de un Mundial. Noppert, el guardameta de Holanda, quizás ha sido la gran sorpresa del torneo. Otra juga que hay que apuntarle a Van Gaal, la portería de Holanda era toda una incógnita a días del pistoletazo de salida, pero el veterano técnico le dio la confianza al portero del Heerenveen. Sus más de dos metros de altura y su buen estado de forma le sitúan como mejor portero, por delante de Livakovic o el Dibu Martínez, recordar que la IA no tiene en cuenta la tanda de penaltis.B. SakaArsenalcentrocampistaReino UnidoNoticiasEstadísticasBukayo Saka completa el XI del Mundial y es el único representante inglés. Su debut ante Irán, con dos goles y las actuaciones ante Senegal o Francia, pese a perder, le sirve para ser el 4º mejor jugador. Ganándole el puesto a Rashford, Grealish o Sterling. Un rendimiento, que en cierta medida sirve para sacarse la espina de la Eurocopa.QATAR 2022Los 12 récords de Leo Messi en el Mundial de Qatar 2022Etiquetado en:Mundial 2022Mundial fútbolKylian MbappéLionel MessiSelección argentinaSelección francesaOlocip"
"1680116308-3","https://as.com/futbol/mundial/","Futuro galáctico para Messi","https://as.com/futbol/mundial/futuro-galactico-para-messi-n/","Este contenido tiene un vídeo que no está disponible en tu zona geográfica
           
        

    
    







“Quedamos con Messi en hablar después del Mundial”. La frase de Nasser Al Khelaïfi en los micrófonos de RMC después de la final entre Argentina y Francia cobra todo el sentido del mundo ahora que Messi es campeón del mundo y está a solo 11 días de poder negociar libremente con cualquier otro club. El argentino concluye su contrato el 30 de junio en París y aún no se sabe si continuará o no. Pero hay una cosa clara: el Mundial ha reforzado al crack argentino.L. MessiPSGdelanteroArgentinaNoticiasEstadísticasLo que sí tenía claro es que no iba a tomar una decisión hasta que supiera lo que el Mundial le deparaba. Y lo que le ha deparado es que ya tiene en sus manos el título más preciado, aquello que le faltaba por conquistar. Esto cambia diametralmente su pensamiento. Ya no está ante la presión de seguir demostrando su grandeza, ya es un jugador legendario esté donde esté, juegue donde juegue.Y tras esta coronación, será él el que decida qué hacer. Su actuación en Qatar le deja en una posición privilegiada. El mejor Messi ha vuelto. Cualquier equipo querrá tenerlo en sus filas. Ofertas no le faltarán. Y como galáctico, todavía.Decisión en su manoSegún sus últimas sensaciones, también pretendía esperar un poco al nivel que pueda dar en las rondas decisivas de la Champions con el PSG para valorar si continúa o no. Lo que está viendo es que, a sus 35 años, las piernas aún le dan para decidir grandes campeonatos y partidos, algo que quizá entierre por ahora el sueño de Inter Miami de llevarlo a la MLS a disfrutar de un retiro dorado.Messi sabe que irse de la máxima élite supondría, por ejemplo, alejarse definitivamente de los Balones de Oro. Aunque el octavo está muy cerca tras lo logrado en Qatar, permanecer en un equipo ganador de títulos y con la Champions como gran desafío como es el PSG le daría opciones de lograr, por qué no, alguno más. En París quieren que siga y ya hay un borrador firmado para una posible renovación. Al Khelaïfi salió triunfador en una situación parecida con Mbappé, al que logró renovar cuando parecía complicado.Messi es otro caso. Aunque la ambición perdura, ya no se puede hacer mucho más en la historia de lo que él ha hecho. En función de lo que le pida el cuerpo decidirá. No tiene prisa. Descansará todo lo que sea necesario después de un final de año trepidante y volverá a París con ganas de seguir jugando al fútbol. Si es hasta final de temporada o por más cursos sólo lo decidirá él. En su mano está.Sigue en la selecciónMessi no jugará el Mundial de 2026, según él mismo, aunque la corriente de la opinión pública ya está haciendo que se lo replantee. El propio Lionel Scaloni dijo en rueda de prensa tras la final que “si quiere, la número 10 queda reservada para él en el próximo Mundial”. Mucha gente en Argentina está pidiendo eso mismo, que juegue en EE UU, México y Canadá en 2026 porque de esta manera se convertiría en el único jugador en la historia en participar en seis Mundiales.De momento, Messi sigue con la selección. No se retira. “Quiero jugar con esta camiseta siendo campeón del mundo”, dijo tras conquistar el Mundial. Los siguientes retos están a la vuelta de la esquina. El principal es la Copa América que se juega en 2024. Queda año y medio para ello. No es demasiado. Viendo su nivel, es posible que pueda llegar a dicha fecha como capitán y leyenda de la Albiceleste.Etiquetado en:FútbolMundial fútbolMundial 2022Lionel MessiSelección argentina fútbolParís Saint Germain"
"1680116311-4","https://as.com/futbol/mundial/","El Mundial de los madridistas","https://as.com/futbol/mundial/el-mundial-de-los-madridistas-n/","F. Fife (AFP) / J. Guez (AFP) /B. Tessier (Reuters)Tchouameni (Francia)Amargo final (falló el penalti que tiró en la tanda) para un sobresaliente Mundial. Aurélien se quedó con la miel en los labios de conquistar el título. Fue una pieza fundamental en el esquema de Deschamps, ya fuese como único pivote o acompañado de Rabiot. Tchouameni cuajó excelentes partidos en ambas situaciones y especialmente destacado fue su partido de semifinales contra Marruecos, aunque en el que marcó fue en los cuartos contra Inglaterra (el 0-1 del partido). Es el único jugador de Francia que ha sido titular en los siete partidos de Les Bleus.Partidos jugados: 7. | Partidos titular: 7. | Minutos: 623. | Goles: 1.AmpliarArgentina's forward #10 Lionel Messi (L) fights for the ball with France's midfielder #08 Aurelien Tchouameni (R) during the Qatar 2022 World Cup final football match between Argentina and France at Lusail Stadium in Lusail, north of Doha on December 18, 2022. (Photo by Adrian DENNIS / AFP)ADRIAN DENNISAFPCamavinga (Francia)El benjamín de la subcampeona del mundo (era su primer gran torneo de selecciones) intervino en dos partidos en una posición novedosa para él. Con la clasificación para octavos en el bolsillo, Deschamps lo colocó de titular contra Australia en el lateral izquierdo, posición en la que dejó buenas sensaciones. Sólo jugó ese partido… y los últimos minutos de la final, de nuevo como lateral izquierdo. Con él entró en el campo el espíritu de las remontadas que protagonizó con el Madrid en la pasada Champions. Saltó al campo en el 71′ y comenzó la remontada incompleta de Francia.PJ: 2. | PT: 1. | Min.: 139.AmpliarArgentina's forward #10 Lionel Messi (R) fights for the ball with France's midfielder #25 Eduardo Camavinga (L) during the Qatar 2022 World Cup final football match between Argentina and France at Lusail Stadium in Lusail, north of Doha on December 18, 2022. (Photo by Anne-Christine POUJOULAT / AFP)ANNE-CHRISTINE POUJOULATAFPBenzema (Francia)Abandonó la concentración de Francia en la víspera del partido inaugural por una lesión en el cuádriceps del muslo izquierdo. La federación francesa no dio de baja su ficha, por lo que el segundo puesto mundialista figurará en su palmarés.Modric (Croacia)El dulce bronce de Luka. Preguntar su edad en un concurso sería una pregunta trampa. Pocos dirían, tras ver su Mundial, que tiene 37 años. Y su carrera internacional continuará al menos hasta junio para intentar ganar la Nations League. Modric sólo se perdió 34 minutos de los siete partidos con su selección. Fue Balón de Bronce (elegido tercer mejor jugador del Mundial) y designado Jugador del Partido en los encuentros contra Marruecos y Bélgica. Fue el madridista que más minutos (656) sumó en Qatar y el segundo que más acumula (2.122′, por detrás de los 2.167 de Vinicius) esta temporada con el Madrid y su selección. Ha sido el segundo jugador que más pases ha completado en campo contrario (284) por detrás de los 322 de Rodri y también el segundo que más centros ha puesto (33), por detrás de Griezmann (40).PJ: 7. | PT: 7. | Min.: 656.AmpliarCroatia's midfielder #10 Luka Modric celebrates with his medal after winning the Qatar 2022 World Cup third place play-off football match between Croatia and Morocco at Khalifa International Stadium in Doha on December 17, 2022. (Photo by JACK GUEZ / AFP)JACK GUEZAFPVinicius (Brasil)La Canarinha se fue de Qatar sin Vinicius sobre el campo. Tite le sustituyó a los 64 minutos del partido de cuartos contra Croacia cuando tenía a toda Brasil encandilada con su Mundial. Fue titular en los cuatro encuentros que jugó (descansó en el tercer partido de la Verdeamarela, contra Camerún) pero sólo disputó completo el de Suiza. Marcó y asistió en la goleada (4-1) a Corea en octavos y también dio una asistencia a Richarlison con el exterior, al más puro estilo Modric, en el estreno frente a Serbia. Buen balance de su primer Mundial.PJ: 4. | PT: 4. | Min.: 302. | Goles: 1 | Asistencias: 2.AmpliarVinicius disputa un balón a Modric en el partido de cuartos de final.INA FASSBENDERAFPMilitao (Brasil)Empezó en el banquillo, pero después Tite aprovechó su polivalencia en defensa. Sólo jugó en su posición habitual de central contra Camerún y lo hizo como lateral derecho frente a Suiza, Corea y Croacia.PJ: 4. | PT: 4. | Min.: 348.AmpliarMilitao se lleva el balón en una pugna con Kovacic.ANNE-CHRISTINE POUJOULATAFPRodrygo (Brasil)Un Mundial de altos y bajos en una línea de ataque con muchísima competencia en la Verdeamarela. Participó en los cinco partidos de Brasil, pero sólo fue titular en uno de ellos, contra Camerún. Jugó en el centro del campo contra Suiza, de mediapunta contra Serbia, Camerún y Corea; y por la izquierda, haciendo de Vinicius, contra Croacia. Dio a Casemiro la asistencia del gol de la trabajada victoria contra Suiza en la segunda jornada y falló uno de los penaltis de la tanda en la que Brasil cayó eliminada.PJ: 5. | PT: 1. | Min.: 179. | Goles: - | Asist.: 1.AmpliarRodrygo conduce el balón en el partido contra Camerún.JEWEL SAMADAFPCarvajal (España)Un partido y medio. Inédito contra Costa Rica y en el adiós de La Roja ante Marruecos, disputó completo el encuentro frente a Alemania y la segunda parte del naufragio contra Japón.PJ: 2. | PT: 1. | Min.: 135.Ampliar30/11/22 PARTIDO FASE DE GRUPOS DOHA MUNDIAL QATAR 2022 
JAPON - ESPAÑA 
JUNYA ITO DANI CARVAJAL JESUS ALVAREZ ORIHUELADiarioASAsensio (España)Luis Enrique le ha dado la confianza que no tiene en el Madrid. En lo que va de temporada ha jugado 384 minutos con la Selección (el 58,2% de los posibles) y 426′ con la camiseta blanca (el 22,5%). Su Mundial, en el que empezó de ‘9′ titular de España, fue de más a menos. Marcó el segundo gol de la esperanzadora goleada (7-0) a Costa Rica, pero en los otros tres partidos (162 minutos acumulados en esos encuentros) sólo efectuó un disparo entre los tres palos.PJ: 4. | PT: 4. | Min.: 231. | Goles: 1.AmpliarAsensio intenta cortar un pase de Selim Amallah en el partido de octavos contra Marruecos.JAVIER SORIANOAFPValverde (Uruguay)Intentó salir al rescate de La Celeste con ese disparo desde larga distancia que tantos réditos le está dando al Madrid esta temporada, pero sin éxito. El Mundial pudo haber sido muy diferente para Uruguay si el misil que estrelló en el palo en el encuentro contra Corea del Sur (Valverde fue elegido Jugador del partido) hubiese encontrado puerta. Jugó los tres partidos completos.PJ: 3. | PT: 3. | Min.: 270.AmpliarValverde, en el partido contra Corea del Sur.ANNE-CHRISTINE POUJOULATAFPRüdiger (Alemania)Como Valverde, el defensa alemán también jugó completos los tres partidos. Se dejó ver mucho en ataque, donde fue pieza clave en las jugadas a balón parado e incluso marcó a España un gol que fue anulado por fuera de juego. Rüdiger tuvo dos parejas en el centro de la zaga: formó con Schlotterbeck en la derrota contra Japón y Flick optó por Süle frente a España y Costa Rica.PJ: 3. | PT: 3. | Min.: 270.AmpliarRüdiger cabecea el balón en el gol que le anularon contra España.ALBERT GEAREUTERSCourtois (Bélgica)Tuvo dos grandes actuaciones en las que no encajó ni contra Canadá (paró un penalti a Davies) ni frente a Croacia (cuatro paradas de mérito) y estuvo desafortunado contra Marruecos, cuando recibió dos goles. Pero de poco sirven las porterías a cero de Courtois si los De Bruyne, Batshuayi, Carrasco, Mertens, Hazard y compañía únicamente son capaces de hacerle un gol a Canadá (de Batshuayi). Al menos, el Mundial servirá para recordar un hito en su carrera: en el último partido, contra Croacia, alcanzó las 100 internacionalidades como los red devils.PJ: 3. | PT: 3. | Min.: 270. | Goles encajados: 2.AmpliarCourtois detiene el penalti a Davies en el minuto 10 del Bélgica-Canadá.PATRICK T. FALLONAFPHazard (Bélgica)Ni su selección (esta temporada ha disputado más minutos con Bélgica que con el Madrid) disfruta ya del juego de Hazard. De jugar una hora (62′ contra Canadá y y 61′ frente a Marruecos) a ser suplente (salió en los últimos tres minutos) en el encuentro decisivo frente a Croacia. Ha dicho adiós a la selección.PJ: 3. | PT: 3. | Min.: 125.AmpliarEden Hazard, con el brazalete de capitán de Bélgica al finalizar el encuentro contra Croacia, su último partido como internacional con los 'red devils'.Simon Stacpoole/OffsideGettyQATAR 2022¿Quién es el mejor de la historia?QATAR 2022El mejor once del Mundial según la Inteligencia ArtificialEtiquetado en:Real MadridFútbolMundial fútbolMundial 2022Aurélien TchouameniCamavingaLuka ModricVinícius JúniorRodrygo GoesÉder MilitaoDani CarvajalMarco AsensioFederico ValverdeAntonio RüdigerThibaut CourtoisHazard"
