web-scraper-order,web-scraper-start-url,noticia,noticia-href,texto
"1680116314-5","https://as.com/futbol/mundial/","El Atlético presume de Mundial","https://as.com/futbol/primera/el-atletico-presume-de-mundial-n/","Noushad ThekkayilEFEEl Atlético tiene la cabeza plenamente enfocada en la visita al Arenteiro, pero también está aún muy presente el Mundial, con esa espectacular final en la que hubo cuatro jugadores rojiblancos —más que de ningún otro equipo—, tres de ellos como campeones. El club presume de su aportación, aunque entre los doce futbolistas que presentó en Qatar ha habido luces y sombras, estrellas y decepciones.De Paul (Argentina)Partidos jugados: 7 | Titular: 7 | Minutos: 602Uno de los más fieles socios de Messi dentro y fuera del campo. Titular en todos los partidos, su rendimiento fue claramente de menos a más. En la primera fase recibió críticas muy ácidas, pero en el tramo final estuvo notable. Tercer jugador con más pases del Mundial tras Rodri y Otamendi, mejor argentino en recuperaciones, en esprints, en presiones...Nahuel (Argentina)P.J.: 7 | P.T.: 6 | Min.: 568 | Goles: 1 | Asistencias: 1Se afianzó como el lateral derecho de Scaloni, titular en seis partidos de siete. Marcó un gol de delantero a Países Bajos y sirvió una asistencia contra Polonia. Notable en ataque y serio en defensa ante retos como Mbappé. Tras un inicio discreto con el Atlético, sale revalorizado de Qatar.Correa (Argentina)P.J.: 1 | P.T.: 0 | Min.: 4Entró a última hora en la lista y solo tuvo cuatro minutos ante Croacia. No obstante, es talismán con la Albiceleste y ya tiene Sudamericano Sub-20, Copa América, Finalissima y Mundial.Griezmann (Francia)P.J.: 7 | P.T.: 6 | Min.: 537 | Asist: 3Uno de los cracks del Mundial, aunque en la final mostró una versión gris. Aun así se va de Qatar como el jugador del Mundial que más ocasiones ha generado (22), el que más asistencias de gol ha dado (tres) y el atacante con más recuperaciones (34).AmpliarADRIAN DENNISGettyGrbic (Croacia)P.J.: 0Se va con la medalla de bronce, aunque sin minutos con Croacia. Livakovic se lo puso imposible.João Félix (Portugal)P.J.: 4 | P.T.: 4 | Min.: 333 | Goles: 1 | Asist: 2El portugués ha ofrecido un buen nivel en Qatar y se asiente como protagonista del futuro en Portugal. Titular para Santos, fue decisivo ante Ghana (jornada 1) y también brilló en octavos, con dos asistencias. En cuartos fue quien más lo intentó ante Marruecos, sin éxito. Ahora le toca pensar en el futuro.Koke (España)P.J.: 2 | P.T.: 0 | Min.: 52Jugó solo 52 minutos: 27 contra Costa Rica y 25 contra Alemania. Ante Japón y Marruecos, derrota y eliminación de España, no jugó. Si De la Fuente cuenta con él, será uno de los capitanes del nuevo ciclo de la Selección, pero la competencia es altísima.Morata (España)P.J.: 4 | P.T.: 1 | Min.: 183 | Goles: 3 | Asist: 1El ariete fue uno de los pocos de España que aprueban en este Mundial. Tres goles y una asistencia en 183 minutos, porque jugó los cuatro partidos, pero solo uno como titular. Importante para Luis Enrique, se le espera también en los planes de De la Fuente.AmpliarMorata celebra el 1-0 de España ante Japón en el estadio Khalifa.JESUS ALVAREZ ORIHUELADIARIO AS Marcos Llorente (España)P.J.: 1 | P.T.: 1 | Min.: 120En la fase de grupos no jugó ni un minuto y contra Marruecos fue titular, pero como lateral derecho. Boufal le hizo sufrir mucho.Giménez (Uruguay)P.J.: 3 | P.T.: 3 | Min.: 270Jugó los 270 minutos de la primera fase y ayudó a que Uruguay dejara la puerta a cero en dos de los tres partidos.Witsel (Bélgica)P.J.: 3 | P.T.: 3 | Min.: 270Fijo para Roberto Martínez, pero no brilló y es uno de los nombres más criticados en Bélgica. Es duda para el siguiente ciclo, dependerá también de la opinión del nuevo seleccionador.Carrasco (Bélgica)P.J.: 2 | P.T.: 2 | Min.: 117Gris actuación, aunque solo jugó 117 minutos. Cometió un penalti, más otro del que le libró el VAR y realizó solo un regate.QATAR 2022 | ANDRÉS ONRUBIA“Piden entre 35 y 40 millones por él”: el ‘nuevo Modric’ al que el Atleti dejó escaparATLÉTICO DE MADRIDUna ganga para el AtléticoEtiquetado en:Atlético MadridMundial 2022Rodrigo de PaulNahuel MolinaÁngel CorreaAntoine GriezmannJoao Felix"
"1680116317-6","https://as.com/futbol/mundial/","La vuelta de Messi a París se retrasa","https://as.com/futbol/la-vuelta-de-messi-a-paris-se-retrasa-n/","LEE SMITHREUTERSLeo Messi tendrá unas merecidas vacaciones cuando acabe de celebrar el título de campeón del mundo con Argentina. El rosarino realizó un Mundial extraordinario e hizo lo imposible para ganar el único título que le faltaba a su interminable palmarés. Tras un torneo agotador tanto en lo físico como en lo mental, es poco probable que vuelva a jugar con el PSG hasta dentro de prácticamente un mes.Según informó Le Parisien, el astro argentino no volverá a los entrenamientos, como mínimo, hasta comienzos de enero. Tendrá 12 días de vacaciones y podría alargar su parón para llegar en plenas condiciones a competir con el PSG. Lo que es seguro es que no jugará ni contra el Estrasburgo, el 28 de diciembre en el Parque de los Príncipes, ni contra el Lens, a pesar de la importancia del partido, el 1 de enero en el Bollaert.En el mejor de los casos, el recién MVP del Mundial debería, a priori, volver a mediados de enero para volver a los terrenos de juego con el PSG. No sin antes seguir un plan específico que definirán, en consonancia, el staff médico de la selección y el conjunto parisino. El objetivo es que Messi llegue en plenas condiciones a la eliminatoria de octavos de final contra el Bayern de Múnich. La Champions, esa competición que se le resiste desde 2015, será el próximo título que podría agrandar todavía más su leyenda.Etiquetado en:París Saint GermainLionel Messi"
"1680116320-7","https://as.com/futbol/mundial/","La Federación Francesa denuncia insultos racistas","https://as.com/futbol/mundial/la-federacion-francesa-de-futbol-presenta-una-denuncia-por-insultos-racistas-n/","FRANCK FIFEGettyLa Federación Francesa de Fútbol va a interponer una demanda contra los autores de insultos racistas en las redes sociales después de la derrota de la selección en la final del Mundial contra Argentina. Tchouaméni, Coman, Kolo Muani y Lloris fueron víctimas de una oleada de comentarios racistas que obligaron a intervenir al máximo organismo del fútbol francés.A Tchouaméni y Coman se les insultó por sus respectivos fallos en la tanda de penaltis, a Lloris por no parar ni un penalti y a Kolo Muani por haber errado la ocasión en el último minuto de la prórroga que podría haberle dado a Francia su tercera estrella. Centenares de insultos racistas inundaron las redes sociales de los internacionales franceses, lo que ha obligado a intervenir a la Federación Francesa de Fútbol.De hecho, el Bayern ya había reaccionado este lunes en las redes sociales para mostrar apoyo a Kingsley Coman, que fue uno de los que más insultos había recibido en las últimas horas por su fallo en la tanda de penaltis. En 2021, Kylian Mbappé ya había sido víctima de actos intolerables tras no haber materializado su penalti ante Suiza en los octavos de la Eurocopa, llegando a plantearse, tal y como confirmó en una entrevista con L’Équipe, dejar la selección por un período indeterminado.Etiquetado en:FútbolMundial fútbolMundial 2022Aurélien TchouameniSelección francesaKingsley Coman"
"1680116322-8","https://as.com/futbol/mundial/","El combate futbolístico del siglo","https://as.com/futbol/2022/12/20/reportajes/1671535259_464090.html","null"
"1680116325-9","https://as.com/futbol/mundial/","Revolución ‘Mundial’ en 2026","https://as.com/futbol/mundial/revolucion-mundial-en-2026-n/","ANPGettyCon la final más épica de la historia de los Mundiales, en la que la Argentina de Leo Messi volvió a tocar el cielo 36 años después, la Copa del Mundo de Qatar echó el telón. Ahora, la cuente regresiva hacia una nueva cita mundialista ha comenzado. Por el camino, aguardan 1.267 días para que la pelota vuelva a rodar en un Mundial. O lo que es lo mismo, una espera de tres años y medio. Será en 2026 en una edición histórica, pues contiene modificaciones en el torneo nunca jamás antes vistas en una Copa del Mundo.La vigésimo tercera edición de los Mundiales se celebrará entre el 9 de junio y el 18 de julio de 2026. Y por primera vez en la historia, hasta tres países albergarán la Copa del Mundo. Estados Unidos, México y Canada son los territorios elegidos. Así, esta cita mundialista será la pionera con una celebración de forma tripartita que contará con un total de hasta 16 sedes para su disputa.Pero las novedades no terminan ahí ya que, el Mundial de 2026 será la primera Copa del Mundo en la que participen 48 selecciones. Sin duda, una novedad muy importante, pues desde el Mundial de Francia de 1998, han sido 32 los equipos que han formado la fase final de una cita mundialista. El aumento de la cifra de equipos participantes ha estado en disyuntiva desde su oficialidad, ya que la incertidumbre de que una mayor cantidad de partidos reduzca la calidad de los mismos está encima de la mesa. Aún así, esta inflación de equipos abrirá el abanico a que países con menos tradición futbolística puedan disputar un Mundial.Además, el aumento en 2026 de un Mundial con sede en tres países diferentes y un mayor número de participantes no serán las únicas modificaciones. En busca de una mayor justicia, habrá tandas de penalti de desempate. En caso de equidad al final del tiempo reglamentario, se celebrarán lanzamientos desde los once metros y el ganador de la serie tendrá un punto extra con el que se logrará deshacer la igualdad de puntos en la fase de grupos.Así, el Mundial de 2026 presentará grandes alteraciones fuera del verde. Pero también sobre él. En Qatar, el inicio de una nueva era de futbolistas era notoria. En la próxima Copa del Mundo, el relevo generacional será una realidad absoluta. Los Messi, Cristiano, Modric, Benzema, Luis Suárez, Busquets o Dani Alves darán un paso al lado, dado su edad y la lejanía de la próxima cita mundialista, mientras que los Mbappé, Haaland, Pedri, Foden o Musiala lo darán al frente. Aunque, algunos como el francés, lo hayan hecho ya.QATAR 2022 | ARGENTINA 3 (4) - FRANCIA 3 (2)Análisis táctico del 2-0 de Argentina a Francia: Mac Allister, Messi, Di María... COPA DEL MUNDOHay debate: ¿fue mejor la del Dibu que estas? Las mejores paradas de la historia del fútbolEtiquetado en:FútbolMundial fútbolMundial 2022Mundial 2026"
"1680116328-10","https://as.com/futbol/mundial/","Descifrando a Scaloni y Pochettino: la virtud esencial para lanzar a Argentina hacia la gloria","https://as.com/videos/mas-futbol/descifrando-a-scaloni-y-pochettino-la-virtud-esencial-para-lanzar-a-argentina-hacia-la-gloria-en-el-mundial-v/","AStvEtiquetado en:Álvaro Benito Villar ""Álvaro""Lionel ScaloniSelección argentina fútbolMundial 2022Mauricio Pochettino TrosseroParís Saint GermainTottenham HotspurMovistar +"
"1680116330-11","https://as.com/futbol/mundial/","El secretario de FIFPRO carga contra otro Mundial en invierno","https://as.com/futbol/mundial/el-secretario-de-fifpro-carga-contra-otro-mundial-en-invierno-v/","Stats PerformEtiquetado en:FIFProMundial 2022Fútbol"
"1680116333-12","https://as.com/futbol/mundial/","La RFEF confirma la adhesión de Marruecos a la Candidatura Ibérica","https://as.com/futbol/mundial/la-rfef-confirma-la-adhesion-de-marruecos-a-la-candidatura-iberica-n/","Pedro GonzalezDiarioASLa Federación Española de Fútbol (RFEF) ha confirmado en un comunicado oficial que Marruecos se incorpora desde hoy mismo a la Candidatura Ibérica para el Mundial que integran, además, España y Portugal y, de momento, también Ucrania. Luis Rubiales y Fernando Gomes, presidentes respectivamente de la RFEF y la FPF , han alcanzado un acuerdo con Fouzi Lekjaa, presidente de la Real Federación Marroquí de Fútbol (FRMF), para conformar la candidatura al Mundial 2030 más potente posible en términos sociales, deportivos y culturales, así como en infraestructuras. Luis Rubiales y Fernando Gomes han anunciado esta decisión a los representantes de la federaciones europeas, en la reunión de UEFA organizada en el marco del Congreso de la FIFA que tendrá lugar mañana en Kigali. El anuncio ha sido recibido de manera muy positiva”, dice el comunicado federativo.La noticia, adelantada en exclusiva por AS el pasado jueves, ya fue ratificada ayer por el rey de Marruecos, Mohamed VI, y se daba por segura en la propia FIFA que, sin embargo, tendrá que adaptar sus reglas para aprobar que, por vez primera, países de distintos continentes puedan conformar una candidatura conjunta. “Se trata de una candidatura histórica, ya que por primera vez se celebraría un Mundial masculino en dos continentes diferentes de manera conjunta. La unión de los tres países vecinos contribuirá a fortalecer los lazos entre Europa y África, además de todo el Mediterráneo; e inspirará a miles de jóvenes de ambos continentes en un proyecto común que tiene su eje fundamental en el impacto que puede tener el fútbol en el desarrollo deportivo y social de la región”, precisa el comunicado de la RFEF.En cuanto a Ucrania, su participación está en el aire. En Ucrania se ha producido recientemente una injerencia gubernamental que ha concluido con la apertura de un expediente de suspensión a Andriy Pavelko, presidente de su federación. Ante esta situación, tanto la Federación Española de Fútbol como la de Portugal y la propia UEFA han decidido aplazar la inclusión de Ucrania en la candidatura hasta que se resuelva el caso. “La participación de Ucrania en el proyecto se concretará en el momento oportuno, debido a la situación que atraviesa tanto el país como el Presidente de la AUF, Andriy Pavelko, actualmente suspendido de sus funciones”, dice el comunicado de la Federación.Por otra parte, según la RFEF, la incorporación de Marruecos no afectará al número de sedes previstas en España (10-12) y Portugal (2, Lisboa y Oporto). Marruecos ofrece tres estadios en Rabat, Marrakech y Casablanca. El formato del Mundial cambiará notablemente ya en su edición de 2026. Participarán 48 equipos y se disputarán 80 partidos, 16 más que en Qatar de 2022. Eso implica la necesidad de disponer de más sedes también en 2030. La presencia de Marruecos le daría un contexto más global al evento.Etiquetado en:RFEFMundial 2030UEFAGianni Infantino"
"1680116336-13","https://as.com/futbol/mundial/","Haaland, con esperanzas de Mundial","https://as.com/futbol/mundial/haaland-con-esperanzas-de-mundial-n/","JAVAD PARSAAFPLa Copa del Mundo de fútbol que se celebrará en 2026 en Estados Unidos, México y Canadá será la primera que contará con la participación de 48 selecciones, 16 más que las que han disputado la edición recién disputada en Catar, lo que abre las opciones de mostrarse a algunos países que llevan tiempo llamando a la puerta de la gran cita.De los participantes, 16 pertenecerán al fútbol europeo, que hasta el momento contaba con 13. Sudamérica ampliará de 4 ó 5 a 6, África subirá de los 5 actuales a los 9, Asia de 4 ó 5 a 8, la CONCACAF de 3 ó 4 a 6 (tres aparte de los anfitriones en el 2026) y Oceanía tendrá uno fijo. Los dos restantes se decidirán por playoffs. Dentro de los posibles aspirantes a las nuevas plazas, estos son los principales favoritos.EuropaEl modelo de clasificación se anunciará en el mes de enero del año 2023 pero el continente, en proporción, será el menos beneficiado por esta ampliación. Pese a ello habrá menos opciones de que se produzcan ‘sustos’ como el que se ha llevado Italia en las dos últimas ediciones.A partir de ahí, todo queda muy abierto. Austria, Suecia, Ucrania o Turquía son de las que mejor rendimiento han dado de un tiempo a esta parte pero también piden paso la Noruega de Haaland y Odegaard, Hungría o Islandia. Queda además por ver qué decisión se toma con Rusia, que cuenta con un plantel potente.SudaméricaMás de la mitad de las selecciones que tomarán parte en la fase de clasificación de la CONMEBOL van a estar presentes con seguridad en el Mundial. Aun así, seguirá siendo complicado acabar entre los primeros puestos ya que la competencia y el nivel parece crecer cada vez más.De repetirse la historia más reciente, Perú iría directa evitando la repesca y Colombia le habría acompañado. Chile y Paraguay, mundialistas recientes, tendrían ahora más opciones de volver al igual que Bolivia, cuya única participación se remonta al año 1994. Además también sueña Venezuela con saldar una cuenta pendiente con su historia y acudir por primera vez.ÁfricaEl fútbol africano se encuentra ante su gran oportunidad de brillar. Rota ya por Marruecos en el Mundial de Catar la barrera psicológica de pasar de cuartos, todos esperan ahora igualar o superar esa gesta. Y las opciones serán mayores a partir del año 2026.El aumento de cuatro cupos suavizará el exigente proceso de clasificación, una afilada guillotina para equipos que no están exentos de calidad. Egipto, tres veces campeona y dos subcampeona de la Copa África desde el 2006 pero que solo ha jugado dos mundiales en su historia, es el gran ejemplo. Pero hay más. Mali, Nigeria, Costa de Marfil, Argelia, Sudáfrica, Burkina Faso... varios serán los que entren y aun así seguirán quedándose combinados potentes con la miel en los labios.AsiaEl continente asiático ya tiene diseñado su complejo camino hacia la próxima Copa del Mundo, con hasta cinco rondas a pesar de que a partir de la tercera ya se empezarán a conocer los primeros equipos clasificados. Los que han estado presentes en Qatar 2022, o al menos la mayoría de ellos, deberían repetir dentro de cuatro años.Al margen de estos, queda un resquicio para que se ‘cuele’ alguno más. Emiratos Árabes Unidos es de las que más fuerte ha pujado en la zona durante los últimos años, algo parecido a lo que sucede con Irak, campeona de la Copa Asia en el 2007. China u Omán también se muestran, aunque la próxima edición del torneo continental en el 2023 podría dejar las cosas más claras.OceaníaSerá la primera vez en la historia en la que Oceanía cuente con una plaza fija después de que siempre se haya jugado su presencia con un playoff que a veces les ha sido esquivo, circunstancia que animó a Australia a pedir pelear en la conferencia asiática.Sin su presencia como aspirante, el trayecto parece a día de hoy asfaltado para Nueva Zelanda, a priori muy superior por nivel al resto de sus rivales. Tanto es así que la selección no pierde un partido de la fase de clasificación para el Mundial en la zona desde un 0-2 contra Fiyi en noviembre del 2008. A partir de se momento, ha disputado 23 partidos y ha ganado 20, recibiendo 9 goles y marcando 62.NorteaméricaEn 2026 el proceso vendrá condicionado porque tres países que han estado en Qatar 2022 repetirán al ser anfitriones. Son los casos de Estados Unidos, México y Canadá. A partir de ahí, todo puede suceder con las tres plazas restantes, siendo Costa Rica firme candidata a una de ellas.Panamá, que ya estuvo en Rusia 2018, se quedó a solo cuatro puntos de la repesca para el último Mundial y creó una brecha notable con sus perseguidores, Jamaica y El Salvador. Honduras o Trinidad y Tobago, que ya saben lo que es participar en el torneo, tienen tiempo aún para presentar sus credenciales. Etiquetado en:Mundial 2026NoruegaHaalandMartin Odegaard"
"1680116339-14","https://as.com/futbol/mundial/","Argentina no es la mejor del mundo... ¡por los penaltis!","https://as.com/futbol/brasil-sigue-lider-ranking-fifa-y-espana-cae-al-decimo-puesto-n/","JESUS ALVAREZ ORIHUELADiarioASBrasil, a pesar de caer en cuartos de final del Mundial de Catar 2022 frente a Croacia, en la tanda de penaltis, se mantiene como líder del ranking FIFA, seguida de la campeona, Argentina, que sube hasta la segunda posición y con España, eliminada en octavos por Marruecos, cayendo tres lugares hasta la décima plaza.Un equipo africano, Marruecos, que sube once puestos respecto a la última actualización, colocándose a las puertas del top-10 (undécimo lugar) y convirtiéndose en la selección que más puntos ha sumado con 108,85.La principal caída en cuanto a posiciones la firma Canadá, con 12, quien dejó Qatar 2022 sin sumar puntos, anotando dos goles y recibiendo siete. En cuanto a puntos, Dinamarca, también tras firmar un Mundial decepcionante con solo un punto, perdió 58,46. El conjunto danés pierde su lugar en el top-10, cayendo a la 18º posición, y es Croacia la que se cuela entre los diez mejores ocupando la séptima posición.Unos diez primeros lugares que cierra España, tras caer tres puestos. La eliminación en octavos del entonces equipo dirigido por Luis Enrique le ha hecho bajar hasta la décima posición.La clasificación que sigue liderando Brasil por un estrecho margen de poco más de dos puntos. Es más, según informa la FIFA, si la albiceleste hubiera ganado a Francia en el tiempo reglamentario o en la prórroga serían los de Scaloni los que ocuparían la primera plaza.Dentro del top-10, otras dos grandes bajadas son las de Bélgica, eliminada en fase de grupos, e Italia, quien no se clasificó para Qatar 2022. Ambas pierden dos posiciones.Top-10 ranking FIFA:1. Brasil: 1.840,77 puntos2. Argentina: 1.838,38 puntos3. Francia: 1.823,39 puntos4. Bélgica: 1.781,30 puntos5. Inglaterra: 1.774,19 puntos6. Países Bajos: 1.740,92 puntos7. Croacia: 1.727,52 puntos8. Italia: 1.723,56 puntos9. Portugal: 1.702,54 puntos10. España: 1.692,71.FRANCIANeymar está de vueltaMUNDIAL 2026Haaland, con esperanzas de MundialEtiquetado en:Mundial 2022Selección española fútbolSelección brasileña fútbolSelección argentina fútbol"
