web-scraper-order,web-scraper-start-url,noticia,noticia-href,texto
"1680116342-15","https://as.com/futbol/mundial/","La psicología explica las tretas 'maquiavélicas' del 'Dibu'","https://as.com/futbol/cuando-dibu-martinez-se-convirtio-en-maquiavelo-n/","59:45 / 00:00La mente es el corazón más potente del cuerpo hurmano. Y, dentro de esa faceta vital, también ayuda a ganar partidos. Por ello, Geir Jordet decidió analizar los comportamientos del jugador de fútbol dentro de un terreno de juego. En algunos deportes, donde la estrategia es forzar el fallo rival, el elemento psicólogico es fundamental. En el caso de Dibu Martínez, portero de carácter sólido y exclusivo, el poder de la mente fue clave en la tanda de penaltis que decidió la tercera estrella para Argetina.Martínez llevó a cabo un juego mental diseccionado al detalle por este psicólogo danés. Geir Jordet definió que el portero argentino ganó la batalla mental y forzó los fallos de Kingsley Coman y Aurélien Tchouaméni. El juego de Dibu Martínez arrancó en los prolegómenos de la tanda, tratando de hacerse con el aréa penal contra Lloris. Mientras Lloris miraba cómo caía la moneda que determinaría el orden de lanzamiento, Martínez se dirigía a la portería para esperar allí a Lloris y darle la bienvenida. Como un padre esperando la llegada de la pareja de su hijo. Como si le estuviera diciendo: “Bienvenido a mi casa, Hugo”.AmpliarYa inmersos en la tanda, Martínez arranca su juego particular con el lanzador. Se muestra cordial y cálido. La respuesta mental llama a bajar la guardia del lanzador y provocando vulnerabilidad. Así lo indica Jordet. A Lloris le recibe de ese modo. De la misma forma a Mbappé. Aunque, en el caso de último, no tardó en acudir a su otro elemento del plan: las interrupciones sútiles y silenciosas. Ayudándole a conocer al árbitro. “Con Mbappé insta al árbitro a revisar la colocación del balón. El árbitro amablemente obedece y responde con un ‘pulgar hacia arriba’”.AmpliarLlega el turno de Coman y el Dibu sigue con su hoja de ruta con un pequeño giro: aumentar la presión sobre el colegiado. Obliga de nuevo a Marciniak a comprobar la posición del balón. La respuesta es obediente y es cuando Martínez ya sabe que el área es suya. Es momento de parar. Dibu detiene el penalti de Coman.Ampliar“Las investigaciones muestran que las celebraciones grandes e intensas indican confianza, dominio y superioridad, lo que afecta positivamente a los compañeros de equipo y negativamente a los oponentes. Martínez capitaliza al máximo su primer salvamento” señala el psicólogo. Martínez no se cortó a la hora de celebrar, algo extraño de ver en tandas tan intensas.

Rebosante de confianza por parar el penalti de Coman, llega el turno de Tchouaméni. Es cuando Dibu empieza a jugar de nuevo su partido particular. En el momento en el que el jugador del Real Madrid se dirige a lanzarlo, Martínez, balón en mano, se vuelve hacia la afición argentina a hacer ruido, a aumentar la presión sobre el lanzador.Una vez llega Tchouaméni a los once metros, Dibu le lanza el balón, obligando al jugador a recogerlo. Una falta de consideración por el rival cuya representación en el portero es una media sonrisa victoriosa. La respuesta del jugador francés vino en forma de fallo, aniquilado por la presión.AmpliarLUSAIL CITY, QATAR - DECEMBER 18: Leandro Paredes of Argentina celebrates with Emiliano Martinez after scoring the team's third penalty in the penalty shoot out during the FIFA World Cup Qatar 2022 Final match between Argentina and France at Lusail Stadium on December 18, 2022 in Lusail City, Qatar. (Photo by Maja Hitij - FIFA/FIFA via Getty Images)Maja Hitij - FIFAGettyCuando llegó el turno de lanzamiento de Paredes, Dibu pensó que Lloris podría usar la misma picardía que él, por eso decidió entregarle el balón en mano a su compañero. Imposibilitando así, cualquier tipo de intento de ‘juego mental’ por parte del portero francés.El cuarto lanzador de Francia fue Randal Kolo Muani. En este caso, “Martínez primero pareció comunicarse y hacer un gesto con alguien del banco de suplentes” de la Selección. Dejando constancia de que le había estudiado, produciendo así un acto de intimidación. El árbitro le sacó amarilla, pero para Martínez fue una amonestación balsámica. Ya se sentía ganador.Para Jordet esos juegos ‘eficaces y sesudos’ dieron valor a una victoria que acabo imprimiendo la tercera estrella sobre la albiceleste. Dibu fue el Dibu de siempre, pero convertido en su forma más maquiavelica. Algo que bien vale una Copa del Mundo.Etiquetado en:Emiliano MartínezSelección argentina fútbolFútbol"
"1680116345-16","https://as.com/futbol/mundial/","Historia de un desprecio: así fue la salida de Benzema de Qatar","https://as.com/futbol/mundial/el-desprecio-de-deschamps-a-benzema-n/","El 19 de noviembre saltó la noticia en Doha cuando trascendió que Karim Benzema abandonaba la concentración de Francia en Qatar al sufrir en el entrenamiento “una lesión en el cuádriceps de la pierna izquierda”. Cuando Karim notó la molestia se dirigió a la clínica Aspetar de Doha, acompañado del médico de la selección francesa, Frank Le Gal. Se publicó ese diagnóstico y Benzema se lo comunicó también a los servicios médicos del Real Madrid. Lo llamativo es que el propio jugador, que conoce su cuerpo como nadie, sabía que el percance no era grave y que en un máximo de 10 días estaría disponible para competir. De hecho, su idea inicial era quedarse en la concentración con Les Bleus para forzar su entrada en el equipo como máximo para el cruce de octavos de final. Solo se perdería la primera fase de clasificación, en la que Francia se midió a Australia, Dinamarca y Túnez. Benzema estaba seguro de que para el cruce de octavos, en este caso ante Polonia el 4 de diciembre, ya hubiese estado totalmente recuperado de su pequeña lesión muscular. Pero su sorpresa llegó cuando estaba en su habitación del hotel Al Messila donde se alojó el equipo de Deschamps en Doha. Llamaron a su puerta y apareció el seleccionador francés junto al doctor Frank Le Gal.El galeno llevó la voz cantante con una frialdad que dejó perplejo a Benzema: “Lo siento Karim, pero te tienes que ir”. Deschamps guardó un silencio muy llamativo, con una falta de sensibilidad que permitió al Balón de Oro abrir los ojos sobre lo que estaba pasando. Literalmente, Deschamps se lo estaba ‘limpiando’ de la convocatoria y así tenía la excusa perfecta para alinear de inicio a Giroud, jugador sobre el que Deschamps siempre tuvo preferencias antes que con la estrella del Real Madrid. Lógicamente, Karim mostró su orgullo y no quiso pleitear sobre la posibilidad de quedarse a recuperarse para llegar a tiempo de ayudar a su equipo. Captó el mensaje, hizo la maleta y cogió un vuelo rápido a Madrid. Al día siguiente ya inició su recuperación en Valdebebas. Y solo una semana después se marchó de vacaciones a Isla Reunión. La lesión estaba totalmente curada y, lo que es peor, el doctor Le Gal le reconoció a Karim que ese mensaje frío y calculado había sido una orden de Deschamps. Él era un simple ‘mandado’.Eso explica la frialdad y el desdén con el que Deschamps hablaba cada vez que los medios le preguntaban por la posibilidad de que Benzema ayudase en el tramo final del Mundial, dado que seguía inscrito en la lista oficial de la FIFA al no haber sido sustituido por ningún otro delantero. “Plantear la pregunta sobre Benzema es un poco torpe. Siguiente pregunta…”, replicaba el seleccionador con un tono altivo y desafiante. Karim, más elegante y educado, respondió en sus redes a medida que iba avanzando Francia en el torneo qatarí: “Es hora, todos juntos, vámonos. Allez Les Bleus”. Todo esto ayudó a Benzema a tomar la decisión que anunció esta misma semana: su retirada definitiva de las convocatorias con Francia. ”Hice el esfuerzo y los errores que hacía falta para estar donde estoy hoy en día. Estoy orgulloso de ello! Escribí mi historia y la nuestra termina”. Atrás quedan 97 partidos con Les Bleus y 37 goles. El vigente Balón de Oro no merecía un final así con su selección, pero Deschamps fue el que provocó todo…INTERNACIONALLos números de Benzema con FranciaQATAR 2022 | FRANCIASueños truncados: las luces y las sombras de Benzema con ‘Les Bleus’Etiquetado en:Real MadridSelección francesa fútbolDidier DeschampsKarim Benzema"
"1680116348-17","https://as.com/futbol/mundial/","La FIFA no detectó casos de amaños durante el Mundial","https://as.com/futbol/mundial/la-fifa-no-detecto-casos-de-amanos-durante-el-mundial-n/","MICHAEL BUHOLZERAFPLa FIFA informó este viernes de que no detectó, a través de su grupo de trabajo en materia de integridad, ningún amaño en los 64 partidos que formaron parte del Mundial de Qatar 2022 que finalizó el pasado domingo con la victoria de Argentina en la tanda de penaltis sobre Francia (3-3 y 4-2).Este grupo tuvo como misión supervisar, por primera vez en un Mundial, la manipulación de partidos, así como cuestiones relativas a la integridad.“Como parte de su cometido, el grupo de trabajo analizó informes de seguimiento de mercados de apuestas legales, llevó a cabo investigaciones en diversas jurisdicciones y revisó la vigilancia en las sedes de la competición en busca de conductas sospechosas. No se detectaron amenazas de manipulación de partidos en ninguno de los encuentros disputados durante la competición”, informó el organismo.""La composición del grupo de trabajo garantizaba que la respuesta ante cualquier alerta sobre una posible manipulación de partidos y cuestiones relativas a la integridad durante la Copa Mundial de la FIFA fuera competente, coordinada y oportuna"", completó.Una forma de trabajo para perseguir los amaños que la FIFA estrenó de forma satisfactoria y cuyo próximo gran reto será el Mundial de fútbol femenino que se disputará del 20 de julio al 20 de agosto de 2023 en Australia y Nueva Zelanda. AMAÑOS15 detenidos en una nueva fase de la operación contra amaños en partidos de fútbol modestoEntrevistaV JORNADA JUEGO RESPONSABLE“LaLiga ha sido la primera en denunciar todos los amaños”Etiquetado en:Amaños partidosMundial 2022FIFA"
"1680116350-18","https://as.com/futbol/mundial/","Erdogan dice que Cristiano Ronaldo fue víctima de veto político en el Mundial","https://as.com/futbol/mundial/erdogan-dice-que-cristiano-ronaldo-fue-victima-de-veto-politico-en-el-mundial-n/","El presidente turco, Recep Tayyip Erdogan, afirma que el astro portugués Cristiano Ronaldo fue víctima de un veto político durante el Mundial de Qatar 2022, que el mandatario relacionó indirectamente con su supuesto apoyo a la causa palestina.Hablando a un grupo de jóvenes durante un programa de televisión turca anoche, dijo que “desafortunadamente Ronaldo fue desperdiciado” en el Mundial, en el que Portugal perdió en cuartos de final contra Marruecos (0-1). “Por desgracia, le impusieron un veto político”, declaró el mandatario, que agregó que el jugador “es alguien que defiende la causa palestina”, informó la agencia de noticias oficial turca Anadolu.Eso sí, Erdogan no elaboró en qué basa su afirmación sobre el supuesto apoyo político de Cristiano Ronaldo a los palestinos. “Mandar a un futbolista como Ronaldo al campo cuando sólo quedaban 30 minutos para el final del partido arruinó su psicología y le quitó energía”, dijo Erdogan, quien antes de ser político fue jugador profesional de fútbol. “Según la información que he recibido, (Cristiano) Ronaldo se va ahora a Arabia Saudí”, agregó el mandatario, quien estuvo en Qatar en el partido inaugural y en la final.El presidente turco también dijo que Argentina se merecía ganar el título por su gran juego y por Lionel Messi, “a pesar de la edad (que tiene)”. ”Pero (Kylian) Mbappé es el futuro, tiene 23 años, Messi 34. Ahora está Mbappe; él es el futuro”, concluyó Erdogan en referencia al joven astro que marcó tres goles para Francia en la final contra Argentina.Etiquetado en:Cristiano RonaldoMundial 2022Selección Fútbol Portugal"
"1680116353-19","https://as.com/futbol/mundial/","Cavani: “Si me sancionan por pegar al VAR, al árbitro lo tienen que meter preso”","https://as.com/futbol/mundial/cavani-si-me-sancionan-por-pegar-al-var-al-arbitro-lo-tienen-que-meter-preso-n/","AMR ABDALLAH DALSHREUTERSLas competiciones de clubes han vuelto a la rutina tras el Mundial de Qatar, pero Cavani no se ha olvidado de cómo fue la eliminación de su selección. Uruguay cayó en fase de grupos a pesar de ganar 0-2 a Ghana en el último partido. Les faltó un gol para pasar a octavos. Un tanto que pudo haber llegado en dos posibles penaltis que el colegiado del encuentro, Daniel Siebert, no sañaló. El atacante del Valencia, tras el pitido final, tiró la pantalla del videoarbitraje de camino al vestuario y, preguntado por una posible sanción por esta acción, también se ha acordado del trencilla. “Si a mí me sancionan por pegar al VAR, al árbitro por sacarnos del Mundial, lo tienen que meter preso, porque son errores que con el VAR, todas las cámaras y todos los árbitros que están detrás, no les pueden hacer”, ha afirmado en El Larguero.Edinson CavaniValencia CFdelanteroUruguayNoticiasEstadísticasUruguayUruguayNoticiasEstadísticasEl charrúa no está contento con las decisiones arbitrales, pero tampoco con su gesto: “Son cosas que no se hacen, pero a veces en el fútbol hay ciertas cosas y ciertas impotencias que se escapan de uno por la adrenalina que manejamos, por esa euforia que tenemos en ese momento, y nos equivocamos”. Y es que Uruguay pidió dos penaltis que les podían haber acercado a ese gol que necesitaban para pasar de ronda. Uno por una falta a Darwin Núñez que el colegiado fue a revisar pero no señaló, y otro al final del partido al jugador del Valencia.La Comisión Disciplinaria de la FIFA ya está investigando las acciones de varios jugadores de Uruguay. El 5 de diciembre abrió expediente a Cavani, a José María Giménez (que golpeó con el brazo a un oficial del organismo tras el encuentro) y a Fernando Muslera y Diego Godín por protestas.Pero esta no ha sido la única queja del exjugador del Manchester United con los trencillas. El atacante también ha criticado las dudas que generan las decisiones de los colegiados: “¿Arbitraje? Hoy en día no sabes qué va a pasar. A veces te toca salir a la cancha preguntándote: ¿y qué pasará hoy?, ¿me pitarán un penalti a favor, uno en contra?, ¿tiraré una camiseta y me pitarán penalti?”.ARGENTINA“Messi ha evolucionado hasta ser el ‘padre’ de su selección”MUNDIAL 2030Millonada para el Mundial 2030Etiquetado en:Mundial 2022Mundial fútbolFútbolArbitraje deportivo"
"1680116356-20","https://as.com/futbol/mundial/","Millonada para el Mundial 2030","https://as.com/futbol/mundial/espana-programa-1430-millones-para-el-mundial-2030-n/","RFEFDiarioASLa maquinaria para que España organice, junto con Portugal y Ucrania el Mundial 2030, ya se ha puesto en marcha. El Consejo de Ministros, a petición del ministro de Cultura y Deporte, Miquel Iceta, ha aprobado recientemente el real decreto por el que se regula la concesión directa de una subvención de 7,5 millones de euros a la Real Federación Española de Fútbol para la preparación y desarrollo de la candidatura del Mundial 2030. Esta es una primera inversión está destinada, según informó el Consejo Superior de Deportes (CSD), a “potenciar la candidatura española a través de diversas actividades”. Entre ellas, la celebración de encuentros y eventos en distintas partes del territorio nacional y extranjero; el establecimiento de una oficina técnica para la coordinación de eventos; la difusión de las iniciativas a través de los medios de comunicación social; el desarrollo de las infraestructuras necesarias destinadas a centros de entrenamiento y tecnificación de las selecciones nacionales y autonómicas; y el soporte tecnológico.Esos 7,5 primeros millones aprobados por el Consejo de Ministros representan solo la punta del iceberg de la cantidad presupuestada por el gobierno para la organización del mayor evento futbolístico del planeta. El Gobierno cifra la inversión necesaria para organizar el Mundial de 2030 en 1.430 millones de euros. El importe total de la inversión se dividiría en 750 millones de euros para inversiones en infraestructuras y otros 680 millones destinados a gastos de organización. Esta inversión estimada por el ejecutivo español es muy inferior al gasto que ha supuesto para Qatar organizar el pasado Mundial. Dicho emirato ha invertido 200.000 millones de dólares en lo que ha sido el Mundial más caro de la historia, mientras que Brasil gastó 15.000 millones en la edición de 2014.En cuanto a lo que repercutirá el Mundial para España, las autoridades estiman que el torneo genere un volumen de negocio de unos 5.120 millones de euros y unos 82.513 empleos, además de un importante impacto positivo para la marca España.En estos momentos, la candidatura ibérica, formada por España, Portugal y Ucrania, es la gran favorita para organizar el Mundial 2030. De hecho, solo tiene un contrincante hasta la fecha. Se trata de la alternativa americana, que conforman Chile, Argentina, Paraguay y Uruguay, pero que ni siquiera tiene comité organizador ni infraestructuras para desarrollar su plan. Esta opción está liderada por la Conmebol que quiere atraer a Sudamérica el Mundial aprovechando los 100 años de su primera edición en suelo uruguayo. Sin embargo, el hecho de que el Mundial 2026 se vaya a celebrar en el continente americano (Canadá, Estados Unidos y México) le resta casi todas las opciones de ser elegida.A medida que pasan los días, coge fuerza la opción de que Arabia Saudí pueda liderar una candidatura. De hecho, la llegada de Cristiano al club Al Nassr se considera una maniobra dirigida a convertirle en la imagen de dicha alternativa, al estilo de lo que hicieron Qatar y el PSG con Messi y Neymar. Dentro de esta candidatura podrían incluirse Grecia y Egipto. No obstante, la Federación Española de Fútbol aprovechará la disputa de la Supercopa en Ryad para mantener reuniones con las autoridades de Arabia Saudí y conocer de primera mano sus intenciones.También hay rumores de que Marruecos y China podrían presentar sus respectivos proyectos para el Mundial 2030, aunque en las últimas semanas parece que el gigante asiático aplazará su candidatura para el Mundial 2034. En cuanto al país norteafricano, ha tratado de formar parte de la alternativa liderada por España y Portugal, aunque sin éxito, y trabaja para poder presentar una alternativa independiente, aprovechando el gran papel realizado por su selección en el pasado Mundial de Qatar. Sea como fuere, la Federación Internacional de Fútbol Asociación (FIFA) aprobará a lo largo del primer trimestre de 2023 las normas que regirán el desarrollo del Mundial 2030. A partir de ese momento, podrían hacerse oficial algunas de estas supuestas candidaturas que competirían con la que lidera España. Y será durante el primer semestre de 2024 cuando se anuncie qué opción se lleva el gato al agua para organizar el Mundial 2030.La candidatura formada por España, Portugal y Ucrania cuenta con el respaldo de la UEFA y, a priori, con todos los votos de las federaciones europeas, a la espera de si Grecia entra en una supuesta candidatura con Arabia Saudí.Las posibles sedesEl Santiago Bernabéu y el Camp Nou lideran las 15 sedes españolas que han presentado su candidatura para albergar encuentros del Mundial 2030. De hecho, el coliseo madridista, que en ese momento sería uno de los estadios más modernos del mundo, acogería la gran final. Juntos a ellos, San Mamés, Metropolitano y La Cartuja tendrían asegurada casi al 100% su participación en el Mundial, mientras que La Rosaleda, el Reale Arena. el RCDE Stadium, el Nuevo Mestalla, El Molinón, La Romareda, el estadio de Gran Canaria, Balaídos, Riazor y la Nueva Condomina optan a las otras seis plazas que quedarían vacantes. Portugal, por su parte, tendría tres sedes, que serían los estadios Da Luz, José Alvalade y Do Dragao. En cuanto a Ucrania, todo depende de cómo evolucione la guerra con Rusia, aunque, en principio, sólo acogería la disputa de dos encuentros de la primera fase.INGLATERRALuis Díaz, presente en Anfield para Liverpool - LeicesterFÚTBOL INTERNACIONALCristiano firma por un salario récord con Al-NassrEtiquetado en:FútbolMundial fútbolMundial 2030EspañaRFEFPortugalUcrania"
"1680116360-21","https://as.com/futbol/mundial/","Cristiano, 200M€ por ser ‘rival’ de la candidatura ibérica para el Mundial 2030","https://as.com/futbol/internacional/cristiano-200-m-por-ser-rival-de-la-candidatura-iberica-para-el-mundial-2030-n/","El histórico contrato de Cristiano Ronaldo con el Al Nassr no solo se compone de tres cifras, también de tres roles. Tal y como pudo confirmar AS, los entresijos de los siete años de la relación contractual que unirá al portugués con el club saudí contemplan un vínculo sobre el terreno de juego hasta el próximo 2025, para pasar a ejercer una labor de asesor o consejero una vez cumpla los 40 años.Pero, además, tal y como ha podido conocer la agencia de noticias, ‘AFP’, de fuentes internas del equipo dirigido por Rudi García, ostentará un rol de embajador de la candidatura tripartita que prepara Arabia Saudí con Egipto y Grecia para albergar el Mundial de 2030, que será la edición número 24. El más inmediato, tras la reciente conclusión de Qatar 2022, lo acogerán Canadá, Estados Unidos y México a mediados de 2026. Será la primera vez que más de dos países sean sede de una cita mundialista.Cristiano RonaldoAl NassrdelanteroPortugalNoticiasEstadísticasCristiano, al adoptar dichas funciones, aún por concretar, recibirá una contraprestación económica cercana a los 200 millones de euros, que se encuadran dentro de los “500 millones netos en concepto de salario durante los próximos siete años” que ya adelantó este diario cuando el exjugador del Manchester United formalizó su contrato el pasado 3 de enero, previa a una presentación multitudinaria.De esta manera, el portugués será ‘contrincante’ en funciones de la candidatura ibérica formada por la propia Portugal, España y Ucrania y que rivaliza con la que forma parte Arabia Saudí. Junto a ellas, también competirá como sede para acoger la cita mundialista otra unión nacional. Aunque esta, de hasta cuatro países: Argentina, Uruguay, Paraguay y Chile, para celebrar el centenario de la CONMEBOL.INTERNACIONALMohamed Bin Salman, el príncipe detrás del fichaje de CR7 en ArabiaINTERNACIONAL¡Cristiano y Mendes rompen!Etiquetado en:Al Nassr FCCristiano RonaldoMundial 2030Arabia SaudíEspaña"
"1680116363-22","https://as.com/futbol/mundial/","Infantino impuso salir en todas las retransmisiones del Mundial","https://as.com/futbol/mundial/infantino-impuso-salir-en-todas-las-retransmisiones-del-mundial-n/","JESUS ALVAREZ ORIHUELADiarioASInfantino estuvo muy presente en el último Mundial. Gracias ala cercanía que había entre los estadios de Qatar y el tiempo entre un partido y otro, el presidente de la Fifa Gianni Infantino, puedo acudir presencialmente a disfrutar a cada uno de los encuentros que se jugaron en el pasado Mundial que terminó ganando Argentino. Al presidente se le vio durante todas las retransmisiones de los encuentros, pero esto no fue casual.Según desvela el diario británico The Times, Infantino dio órdenes exactas a la empresa encargada de realizar la retransmisión de los encuentros, de sacarlo, al menos, una vez durante cada uno de los encuentros. Estos encargados recibieron un email con las instrucciones exactas, ya que no podían sacarlo de todas las maneras. El presidente nunca podría salir mientras estuviera revisando su móvil y siempre tenía que estar mirando al terreno de juego. Si estaba al lado de un jeque, no podían salir de rodillas para abajo.Muchas de las imágenes que salían suyas por televisión no salían en las pantallas del estadio, ya que en alguna ocasión Infantino fue abucheado y decidió que eso no volviera a ocurrir cortando sus imágenes en los estadios. Las pautas sobre el uso de la imagen de Infantino provienen de HBS, un servicio de transmisión con sede en Suiza que utiliza la FIFA para los partidos de la Copa del Mundo, sin que las televisiones de cada país pudieran decidir que imagen televisaban en cada momento, por lo que Infantino salió en cada uno de los partidos del Mundial de Qatar.ITALIAInfantino condena los insultos racistas a Umtiti y Banda en el Lecce-LazioQATAR 2022El vídeo que explica el bochorno de Salt Bae en la final: deja en mal lugar a InfantinoEtiquetado en:Mundial 2022FútbolGianni InfantinoTelevisión"
