web-scraper-order,web-scraper-start-url,noticia,noticia-href,texto
"1680116366-23","https://as.com/futbol/mundial/","¡Varane deja Francia con 29 años!","https://as.com/futbol/internacional/varane-deja-la-seleccion-francesa-n/","FRANCK FIFEAFPRaphaël Varane se retira internacionalmente. El defensa, de 29 años, ha decidido no volver a vestir la camiseta de la selección francesa. La final del Mundial contra Argentina, el pasado 18 de diciembre, fue su último partido con Les Bleus.Raphaël VaraneManchester UniteddefensaFranciaNoticiasEstadísticasLa principal razón por la que el exjugador del Real Madrid ha decidido poner punto y final a su carrera internacional son sus continuos problemas físicos, además de la fatiga psicológica que supone cada partido con la selección. El central, además, quiere pasar más tiempo con su familia y centrarse en el Manchester United.Otra despedida en los bluesTras Benzema, Lloris y Mandanda, Varane es el cuarto jugador que deja la selección francesa tras el Mundial de Qatar. Tras más de diez años con la tricolor, 93 internacionalidades y dos títulos, el Mundial de 2018 y la Nations League de 2021, el defensa aspiraba a portar el brazalete de capitán después del retiro de Lloris.El Mundial de Qatar, en el que Francia llegó a la final, desgastó física y mentalmente a Varane. El jugador, que no ha cumplido todavía los 30 años, lideró un cambio de ciclo en la selección francesa que culminó con la Copa del Mundo en Rusia hace cinco años. Según Le Parisien, pronto dará una rueda de prensa para explicar los motivos de su fin con la selección francesa.“Raphaël me llamó hace unos días para explicarme que quería poner fin a su carrera internacional. Es un chico inteligente, que sabe tomarse el tiempo para reflexionar, sopesar los pros y los contras antes de decidir. Sin entrar en los detalles de nuestro intercambio, Raphaël cree que ha llegado al final de su aventura con la selección de Francia. Viví una situación un tanto parecida a la suya, entiendo sus argumentos y respeto su decisión aunque parezca mala en vista de todo lo que pudo hacer con la selección hasta el Mundial en el que se comportó, de principio a fin, como el líder que conocemos”, dijo Deschamps al respecto.Après 🔟 années et 9⃣3⃣ sélections en Bleu, @raphaelvarane a décidé de prendre sa 𝗿𝗲𝘁𝗿𝗮𝗶𝘁𝗲 𝗶𝗻𝘁𝗲𝗿𝗻𝗮𝘁𝗶𝗼𝗻𝗮𝗹𝗲 🇫🇷

𝘔𝘦𝘳𝘤𝘪 𝘱𝘰𝘶𝘳 𝘵𝘰𝘶𝘵 𝘙𝘢𝘱𝘩𝘢𝘦̈𝘭 💙#FiersdetreBleus pic.twitter.com/lh0iKcY4Q9— Equipe de France ⭐⭐ (@equipedefrance) February 2, 2023

La carta de Varane“Representar a nuestro gran país durante una década ha sido uno de los mayores honores de mi vida. Cada vez que vestía este maillot azul tan especial, sentía un orgullo inmenso. El deber de darlo todo, jugar con el corazón y ganar cada vez que entramos al campo. Lo he estado considerando durante varios meses y he decidido que es el momento adecuado para retirarme del fútbol internacional. De niño, recuerdo seguir a Francia 98, a esta selección, a estos jugadores que nos hacían vivir emociones indescriptibles. Soñaba con hacer como nuestros héroes y, 20 años después, viví una de las mejores experiencias de mi vida, una que me enorgulleció mucho. Llevamos la Copa a casa!! Nunca lo olvidaré. Todavía siento cada una de las emociones que sentí ese día, 15 de julio de 2018. Fue uno de los momentos más grandes y memorables de mi vida. Esta victoria que logramos juntos nunca hubiera sido posible sin el apoyo de Didier Deschamps, de cada uno de los miembros de la dirección y de nuestro staff durante estos años, de mis compañeros que defendieron nuestra camiseta en cada uno de nuestros partidos. Pero más importante aún, esta victoria no hubiera sido posible sin el apoyo de cada uno de ustedes a lo largo de este camino. Vuestro entusiasmo, las celebraciones y los recuerdos de nuestro regreso a Francia quedarán grabados en mi mente para siempre. Incluso después de la derrota en la final del año pasado, ciertamente con una gran racha, nos recibieron como héroes cuando regresamos. A todos y cada uno de vosotros, mil veces ¡GRACIAS! Seguro que extrañaré estos momentos contigo, pero ha llegado el momento de que la nueva generación tome el relevo. Tenemos un grupo de jugadores jóvenes talentosos que están listos para hacerse cargo, que merecen una oportunidad y que te necesitan. Desde el fondo de mi corazón, gracias. Rafael”.
Etiquetado en:Selección francesa fútbolVaraneMundial 2022Manchester United"
"1680116369-24","https://as.com/futbol/mundial/","Grecia confirma contactos con Arabia Saudí y Egipto para el Mundial 2030","https://as.com/futbol/mundial/grecia-confirma-contactos-con-arabia-saudi-y-egipto-para-mundial-2030-n/","@l_avgenakisEl Gobierno de Grecia confirmó este miércoles que está en contacto con las autoridades de Arabia Saudí y Egipto para estudiar una candidatura conjunta para organizar el Mundial de fútbol de 2030. El viceministro de Cultura y Deportes, Lefteris Avgenakis, dijo en su cuenta de Twitter que los tres países “aún están en las primeras etapas de exploración de las posibilidades para una candidatura”.La confirmación de Avgenakis llega después de que el portal de noticias Politico publicara un reportaje en el que señala que Arabia Saudí se habría ofrecido a financiar la construcción de nuevos estadios en Grecia y Egipto a cambio de que los dos países acepten presentar una candidatura conjunta ante la FIFA. Según Avgenakis, el reportaje de Politico está lleno de “inexactitudes”.El portal asegura además que la oferta saudí se discutió en una conversación privada entre el príncipe heredero, Mohammad bin Salmán, y el primer ministro griego, el conservador Kyriakos Mitsotakis, durante una visita de éste a Riad el verano de 2022.A cambio de pagar los nuevos estadios en Grecia y Egipto, la Monarquía del Golfo, según la misma fuente, pide que tres de cada cuatro partidos del Mundial se jueguen en su territorio.Una candidatura conjunta de estos tres países podría tener buenas posibilidades de ganar, ya que sería la primera vez que un Mundial se jugaría en tres continentes, lo que podría llevar a varios países de África y Asia a este proyecto.El Congreso de la FIFA, compuesto por más de 200 asociaciones nacionales, es el órgano que decidirá el año que viene en una votación la sede de la Copa del Mundo 2030.Las principales rivales de la posible candidatura de Arabia Saudí, Grecia y Egipto son las de España, Portugal y Ucrania, y otra conjunta de Argentina, Uruguay, Paraguay y Chile.MUNDIAL 2030Sudamérica lanza su candidatura al Mundial 2030MUNDIAL 2030Rubiales persigue “perfeccionar” la candidatura al Mundial 2030Etiquetado en:Mundial 2030Mundial fútbolGreciaArabia SaudíEgipto"
"1680116372-25","https://as.com/futbol/mundial/","España estudia la anexión de Marruecos a la Candidatura Ibérica","https://as.com/futbol/mundial/espana-negocia-la-anexion-de-marruecos-a-la-candidatura-iberica-n/","AFP7GettyLa Candidatura Ibérica para organizar el Mundial 2030 puede tener un nuevo invitado. La Real Federación Española de Fútbol (RFEF) y la Federación de Fútbol de Portugal trabajan la opción de incluir a Marruecos en la misma. Su incorporación será estudiada de forma exhaustiva en los próximos días y semanas, pero su adhesión definitiva parece ligada a la salida de Ucrania de la candidatura conjunta de España y Portugal para albergar la cita mundialista.La participación de Ucrania como sede, anunciada el pasado mes de octubre, está ahora mismo en el aire debido al caso de supuesta corrupción que pesa sobre la propia Federación de Fútbol de Ucrania (UFA, en sus siglas en ingles). Andriy Pavelko, presidente de la UFA, está siendo investigado por fraude y lavado de dinero y ha sido suspendido por un período limitado hasta que se esclarezca el asunto. El pasado 29 de noviembre, fue detenido acusado de malversar fondos destinados a la construcción de una fábrica de canchas de fútbol artificiales. Pavelko, que niega haber cometido delito, se enfrenta a una pena de hasta 12 años de prisión.Por este motivo, la RFEF no quiere verse salpicada por el escándalo y ha decidido dejar al margen a Ucrania hasta que se arregle la situación y quede todo claro. La presencia ucraniana en la Candidatura Ibérica era un golpe de efecto que podría volverse en su contra, de ahí la celeridad para contemplar otro escenario en estas próximas fechas. La FIFA anunciará en junio el pliego de condiciones para quien quiera ser candidato a ser sede del Mundial 2030 y en 2024 se oficializará la elección final.Desde la Federación española, aunque no veían la ampliación de la Candidatura Ibérica con Marruecos de una manera prioritaria, se trabaja ahora con el país norafricano para negociar su inclusión. Su presencia había quedado descartada en un principio porque la FIFA y UEFA vetaban las candidaturas conjuntas de países de distintas confederaciones. Pero la salvedad aceptada con la propuesta de Grecia, Turquía y Arabia Saudí ha cambiado el paso y permite a la RFEF y a la Federación portuguesa abrir la puerta a Marruecos. Se supone que la candidatura de Grecia, Turquía y Arabia Saudí no es viable en este momento según los preceptos de la FIFA, que había establecido que debían pasar al menos dos Mundiales para repetir continente, algo que no se cumpliría en el caso de Arabia Saudí tras la disputa del Mundial de Qatar el pasado año. Pero la aparición de Grecia y Turquía parece una triquiñuela dirigida a hacer cambiar de parecer a la FIFA. Bajo este panorama, la RFEF habla con Marruecos para potenciar todavía más la solidez de la proposición de la Candidatura Ibérica.PRIMERA RFEFEl plan para salvar la 1ªRFEFPRIMERA RFEFLos clubes esperan que la Federación pase a la acciónEtiquetado en:FútbolMundial fútbolMundial 2030MarruecosRFEFPortugal"
"1680116374-26","https://as.com/futbol/mundial/","El ‘Dibu’ Martínez: “Tchouameni se cagó”","https://argentina.as.com/futbol/el-dibu-martinez-tchouameni-se-cago-n/","Más de 100.000 personas aclamaron este jueves en la localidad costera de Mar del Plata, a unos 400 kilómetros de Buenos Aires, a Emiliano ‘Dibu’ Martínez, portero de la selección argentina que se proclamó campeona del Mundial de Qatar.El guardameta del Aston Villa, natural de uno de los lugares más turísticos de la costa argentina, recibió un homenaje ante una multitud de personas, como las que se agolparon para presenciar cada encuentro de la Albiceleste en la cita catarí.Una pantalla gigante sobre un escenario donde fue homenajeado mostró imágenes de las distintas actuaciones del ‘Dibu’ a lo largo del Mundial, con especial foco en las dos tandas de penales que Argentina superó en cuartos de final y en la final contra Francia, que dieron la tercera estrella de la historia a la Albiceleste.Ante esa celebración, desde la tarima, el portero indicó que en las tandas de penaltis se hace “fuerte” y sabe que los rivales le “respetan. Cuando atajo el primer penal (ante Francia), sé que el otro chico iba a estar nervioso, la tiró fuera. Se cagó todo”, dijo ante los aplausos de los marplatenses.Martínez, que acudió con el premio de Mejor Portero del torneo y la medalla de campeón, dijo que el capitán, Lionel Messi, “es el mejor jugador del planeta” y su sueño, como el del resto del equipo, era “darle un título a Leo en la selección”.Después de las victorias en la Copa América (2021) y en la Finalissima (2022), “mi sueño final como arquero era darle al mejor del mundo el título mundial para que no haya duda que sea el mejor jugador de toda la historia”, confesó.Martínez se acordó de sus orígenes en cancha de tierra en el barrio Jardín, de Mar del Plata (provincia de Buenos Aires), y expresó su “orgullo” por haber llegado a convertirse en campeón del mundo con Argentina.“Cada partido que jugábamos decíamos que jugábamos por la gente. No vamos por plata a la selección, sino por los colores. Ver a Mar del Plata o los chicos de cada ciudad con tanta gente era un orgullo. Cuando las piernas no daban, el corazón siempre daba un paso adelante”, comentó.Argentina se proclamó campeona del mundo este domingo tras ganar en la tanda de penaltis 4-2 a Francia, después del empate 3-3 en los 120 minutos de juego.La Albiceleste obtuvo su tercer título mundial, después de los conseguidos en Argentina 1978 y México 1986. A estos tres logros, se suman las tres finales perdidas de Uruguay 1930, Italia 1990 y Brasil 2014.Etiquetado en:Emiliano MartínezFútbolSelección argentina fútbolMundial 2022Aurélien Tchouameni"
